<?xml version="1.0"?>
<!--
To change this license header, choose License Headers in Project Properties.
To change this template file, choose Tools | Templates
and open the template in the editor.
-->

<model-config xmlns:xsi="http://www.w3.org/2001/XMLSchema"
	xsi:schemaLocation="http://www.megatimgroup.net/model-config ../xsd/model-config.xsd"
	xmlns="http://www.megatimgroup.net/model-config">
    <elements>
<!--        <element type="com.core.model.server.Etudiant"  idclass="long"  idname="id"   deseable="false">
            <roles>
                <role>ADMIN</role>
            </roles>           
        </element>        -->
        <element type="com.core.menus.MenuModule"  idclass="long"  idname="id" deseable="true">
            <roles>
                <role>ADMIN</role>
            </roles>           
        </element>
        <element type="com.core.menus.MenuGroupActions"  idclass="long"  idname="id" deseable="true">
            <roles>
                <role>ADMIN</role>
            </roles>           
        </element>
        <element type="com.core.menus.MenuAction"  idclass="long"  idname="id" deseable="true">
            <roles>
                <role>ADMIN</role>
            </roles>           
        </element>
        <element type="com.core.menus.ActionItem"  idclass="long"  idname="id" deseable="true">
            <roles>
                <role>ADMIN</role>
            </roles>           
        </element>   
        <element type="com.core.referentiels.Societe"  idclass="Long"  idname="id"  deseable="true">
            <roles>
                <role>ADMIN</role>
            </roles>           
        </element>   
        <element type="com.core.referentiels.Pays"  idclass="Long"  idname="id"   deseable="true">
            <roles>
                <role>ADMIN</role>
            </roles>           
        </element>  
        <element type="com.core.langues.Langue"  idclass="Long"  idname="id"   deseable="true">
            <roles>
                <role>ADMIN</role>
            </roles>           
        </element>  
        <element type="com.core.langues.ChargerLangue"  idclass="Long"  idname="id"   deseable="true">
            <roles>
                <role>ADMIN</role>
            </roles>           
        </element>
        <element type="com.core.securites.Groupe"  idclass="Long"  idname="id"   deseable="true">
            <roles>
                <role>ADMIN</role>
            </roles>           
        </element>  
        <element type="com.core.referentiels.Devise"  idclass="Long"  idname="id"   deseable="true">
            <roles>
                <role>ADMIN</role>
            </roles>           
        </element>  
        <element type="com.core.securites.Utilisateur"  idclass="Long"  idname="id"   deseable="true">
            <roles>
                <role>ADMIN</role>
            </roles>           
        </element> 
        <element type="com.core.calendar.Event"  idclass="Long"  idname="id"   deseable="true">
            <roles>
                <role>ADMIN</role>
            </roles>           
        </element> 
        <element type="com.core.calendar.Rappel"  idclass="Long"  idname="id"   deseable="true">
            <roles>
                <role>ADMIN</role>
            </roles>           
        </element>  
        <element type="com.core.views.FormRecord"  idclass="Long"  idname="id"   deseable="true">
            <roles>
                <role>ADMIN</role>
            </roles>           
        </element>
        <element type="com.core.views.TreeRecord"  idclass="Long"  idname="id"   deseable="true">
            <roles>
                <role>ADMIN</role>
            </roles>           
        </element>
        <element type="com.core.views.ReportRecord"  idclass="Long"  idname="id"   deseable="true">
            <roles>
                <role>ADMIN</role>
            </roles>           
        </element>
        <element type="com.core.referentiels.PieceJointe"  idclass="Long"  idname="id"   deseable="true">
            <roles>
                <role>ADMIN</role>
            </roles>           
        </element>
        <element type="com.core.views.DashboardRecord"  idclass="Long"  idname="id"   deseable="true">
            <roles>
                <role>ADMIN</role>
            </roles>           
        </element>
        <element type="com.core.discussions.Canal"  idclass="Long"  idname="id"   deseable="true">
            <roles>
                <role>ADMIN</role>
            </roles>           
        </element>
        <element type="com.core.discussions.SMessage"  idclass="Long"  idname="id"   deseable="true">
            <roles>
                <role>ADMIN</role>
            </roles>           
        </element>
        <element type="com.core.discussions.RMessage"  idclass="Long"  idname="id"   deseable="true">
            <roles>
                <role>ADMIN</role>
            </roles>           
        </element>
        <element type="com.core.discussions.KMessage"  idclass="Long"  idname="id"   deseable="true">
            <roles>
                <role>ADMIN</role>
            </roles>           
        </element>
        <element type="com.core.discussions.Follower"  idclass="Long"  idname="id"   deseable="true">
            <roles>
                <role>ADMIN</role>
            </roles>           
        </element>
        <element type="com.core.views.CalendarRecord"  idclass="Long"  idname="id"   deseable="true">
            <roles>
                <role>ADMIN</role>
            </roles>           
        </element>
   </elements>
    
</model-config>
