<?xml version="1.0"?>
<!--
To change this license header, choose License Headers in Project Properties.
To change this template file, choose Tools | Templates
and open the template in the editor.
-->

<model-config xmlns:xsi="http://www.w3.org/2001/XMLSchema"
	xsi:schemaLocation="http://www.megatimgroup.net/model-config ../xsd/model-config.xsd"
	xmlns="http://www.megatimgroup.net/model-config">
    <elements>
        <element type="com.teratech.stock.model.base.FamilleArticle"  idclass="long"  idname="id"   deseable="true">
            <roles>
                <role>ADMIN</role>
            </roles>           
        </element>        
        <element type="com.teratech.stock.model.base.Article"  idclass="long"  idname="id" deseable="true">
            <roles>
                <role>ADMIN</role>
            </roles>           
        </element>
       <element type="com.teratech.stock.model.base.CategorieProduit"  idclass="long"  idname="id" deseable="true">
            <roles>
                <role>ADMIN</role>
            </roles>           
        </element>
        <element type="com.teratech.stock.model.base.Pays"  idclass="long"  idname="id" deseable="true">
            <roles>
                <role>ADMIN</role>
            </roles>           
        </element>   
        <element type="com.teratech.stock.model.base.UniteAchat"  idclass="long"  idname="id" deseable="true">
            <roles>
                <role>ADMIN</role>
            </roles>           
        </element>   
        <element type="com.teratech.stock.model.base.UniteGestion"  idclass="long"  idname="id" deseable="true">
            <roles>
                <role>ADMIN</role>
            </roles>           
        </element>   
        <element type="com.teratech.stock.model.comptabilite.JournalComptable"  idclass="Long"  idname="id"  deseable="true">
            <roles>
                <role>ADMIN</role>
            </roles>           
        </element>   
        <element type="com.teratech.stock.model.comptabilite.Compte"  idclass="Long"  idname="id"   deseable="true">
            <roles>
                <role>ADMIN</role>
            </roles>           
        </element>  
        <element type="com.teratech.stock.model.comptabilite.CompteAnalytique"  idclass="Long"  idname="id"   deseable="true">
            <roles>
                <role>ADMIN</role>
            </roles>           
        </element>  
        <element type="com.teratech.stock.model.comptabilite.NiveauAnalyse"  idclass="Long"  idname="id"   deseable="true">
            <roles>
                <role>ADMIN</role>
            </roles>           
        </element>
        <element type="com.teratech.stock.model.comptabilite.SectionAnalytique"  idclass="Long"  idname="id"   deseable="true">
            <roles>
                <role>ADMIN</role>
            </roles>           
        </element>  
        <element type="com.teratech.stock.model.comptabilite.Taxe"  idclass="Long"  idname="id"   deseable="true">
            <roles>
                <role>ADMIN</role>
            </roles>           
        </element>  
        <element type="com.teratech.stock.model.base.Entrepot"  idclass="Long"  idname="id"   deseable="true">
            <roles>
                <role>ADMIN</role>
            </roles>           
        </element>
        <element type="com.teratech.stock.model.base.Region"  idclass="Long"  idname="id"   deseable="true">
            <roles>
                <role>ADMIN</role>
            </roles>           
        </element> 
        <element type="com.teratech.stock.model.base.Region"  idclass="Long"  idname="id"   deseable="true">
            <roles>
                <role>ADMIN</role>
            </roles>           
        </element> 
       <element type="com.teratech.stock.model.base.Tier"  idclass="Long"  idname="id"   deseable="true">
            <roles>
                <role>ADMIN</role>
            </roles>           
        </element> 
        <element type="com.teratech.stock.model.base.Civilite"  idclass="Long"  idname="id"   deseable="true">
            <roles>
                <role>ADMIN</role>
            </roles>           
        </element>  
        <element type="com.teratech.stock.model.base.Contact"  idclass="Long"  idname="id"   deseable="true">
            <roles>
                <role>ADMIN</role>
            </roles>           
        </element>
        <element type="com.teratech.stock.model.base.Entrepot"  idclass="Long"  idname="id"   deseable="true">
            <roles>
                <role>ADMIN</role>
            </roles>           
        </element>
         <element type="com.teratech.stock.model.banques.Banque"  idclass="Long"  idname="id"   deseable="true">
            <roles>
                <role>ADMIN</role>
            </roles>           
        </element>
        <element type="com.teratech.stock.model.banques.CompteBancaire"  idclass="Long"  idname="id"   deseable="true">
            <roles>
                <role>ADMIN</role>
            </roles>           
        </element>
        <element type="com.teratech.stock.model.base.Devise"  idclass="Long"  idname="id"   deseable="true">
            <roles>
                <role>ADMIN</role>
            </roles>           
        </element>
        <element type="com.teratech.stock.model.base.Societe"  idclass="Long"  idname="id"   deseable="true">
            <roles>
                <role>ADMIN</role>
            </roles>           
        </element>
   </elements>    
</model-config>
